{
  "$schema": "http://json-schema.org/draft-07/schema#",
  "type": "array",
  "items": {
    "type": "object",
    "properties": {
      "maDiaDiem": {
        "type": "string",
        "pattern": "[A-Za-z0-9\\-]+",
        "maxLength": 10
      },
      "tenDiaDiem": {
        "type": "string",
         "maxLength": 50
      },
      "moTa": {
        "type": "string",
        "maxLength": 255
      },
      "diaChi": {
        "type": "string",
        "maxLength": 255
      }
    },
    "required": ["maDiaDiem", 
                "tenDiaDiem", 
                "moTa", 
                "diaChi"
            ]
  }
}
